{"schemaVersion":1,"contentVersion":"sha256:bd2e244acaef0b4878dc65af4baeadd6902b41eb019cfee87ee666fa25ab4c6c","generatedAt":"2026-09-01T12:00:00Z","scoringProfile":"default-2026-09","show":{"id":"tt9000001","title":"Cold","year":"2026","endYear":null,"plot":"A deterministic fixture.","poster":"https://image.example/poster.jpg","totalSeasons":0,"genres":["Drama","Mystery"],"ratings":[],"externalIds":{"imdb":"tt9000001","tmdb":"9001","tvmaze":"901"}},"seasons":[],"providers":[{"source":"tmdb","status":"pending","contributed":false,"reason":"not_attempted"},{"source":"combined","status":"computed","contributed":false}],"incomplete":true,"stats":{"episodes":0,"omittedUnnumbered":0,"rated":{}}}