{"schemaVersion":1,"contentVersion":"sha256:55918041bc941e558abd33169960450caec2bb94beb4cb89bc20661d6575a3e8","generatedAt":"2026-09-01T12:00:00Z","scoringProfile":"default-2026-09","show":{"id":"tt9000001","title":"Specials","year":"2026","endYear":null,"plot":"A deterministic fixture.","poster":"https://image.example/poster.jpg","totalSeasons":0,"genres":["Drama","Mystery"],"ratings":[{"source":"imdb","rating":8.8,"votes":200000},{"source":"rtCritics","rating":9.3,"votes":120,"metric":"percentagePositive"},{"source":"mcCritics","rating":8.4,"votes":40},{"source":"combined","rating":8.92,"votes":null,"contributors":["imdb","rtCritics"]}],"externalIds":{"imdb":"tt9000001","tmdb":"9001","tvmaze":"901"}},"seasons":[{"number":0,"title":"Specials","episodes":[{"id":"tt9000002","title":"Episode 1","plot":null,"season":0,"episode":1,"date":"2026-09-01","poster":null,"ratings":[{"source":"imdb","rating":8.6,"votes":4000},{"source":"tmdb","rating":7.9,"votes":800},{"source":"combined","rating":8.36,"votes":null,"contributors":["imdb","tmdb"]}],"sourceIds":{"imdb":"tt9000002"}}]}],"providers":[{"source":"imdb","status":"fresh","contributed":true,"lastSuccessAt":"2026-09-01T10:00:00Z","expiresAt":"2026-09-01T18:00:00Z"},{"source":"tmdb","status":"fresh","contributed":true,"lastSuccessAt":"2026-09-01T10:00:00Z","expiresAt":"2026-09-01T18:00:00Z"},{"source":"rtCritics","status":"fresh","contributed":true,"lastSuccessAt":"2026-09-01T10:00:00Z","expiresAt":"2026-09-01T18:00:00Z"},{"source":"mcCritics","status":"fresh","contributed":true,"lastSuccessAt":"2026-09-01T10:00:00Z","expiresAt":"2026-09-01T18:00:00Z"},{"source":"combined","status":"computed","contributed":true}],"incomplete":false,"stats":{"episodes":1,"omittedUnnumbered":0,"rated":{"imdb":1,"tmdb":1,"combined":1}}}